context;importance;human;response
"los datos de identificación del solicitante o de la persona que presenta la solicitud, o que permitan a la oficina nacional competente comunicarse con esa persona;

	la marca cuyo registro se solicita, o una reproducción de la marca tratándose de marcas denominativas con grafía, forma o color especiales, o de marcas figurativas, mixtas o tridimensionales con o sin color;

		la indicación expresa de los productos o servicios para los cuales desea proteger la marca; y,

	el comprobante de pago de las tasas establecidas.

La ausencia de alguno de los requisitos enumerados en el presente artículo, ocasionará que la solicitud sea considerada por la oficina nacional competente como no admitida a trámite y no se le asignará fecha de presentación.

Artículo 141.- Se podrá invocar como fecha de presentación de una solicitud de registro de marca aquella en que dicha marca haya distinguido productos o servicios en una exposición reconocida oficialmente y realizada en cualquier país, siempre que sea solicitada dentro de los seis meses contados a partir del día en que tales productos o servicios se exhibieran por primera vez con dicha marca. En ese caso, se podrá tener por presentada la solicitud desde la fecha de exhibición.

Los hechos a que se refiere el presente artículo se acreditarán con una certificación expedida por la autoridad competente de la exposición, en la cual se mencionará la fecha en que la marca se utilizó por primera vez con relación a los productos o servicios de que se trate.

Artículo 142.- Cuando el solicitante deseara prevalerse del derecho previsto en el Artículo 6quinquies del Convenio de París para la Protección de la Propiedad Industrial,

deberá presentar el certificado de registro de la marca en el país de origen dentro del plazo de tres meses siguientes a la fecha de presentación de la solicitud.";Alta;Cuáles son los requisitos necesarios para que una solicitud de registro de marca sea considerada admitida a trámite por la oficina nacional competente?;"Según el contexto proporcionado, los requisitos necesarios para que una solicitud de registro de marca sea considerada admitida a trámite por la oficina nacional competente son:

1. Los datos de identificación del solicitante o de quien presenta la solicitud.
2. La marca cuyo registro se solicita, incluyendo una reproducción en casos específicos.
3. La indicación clara de los productos o servicios para los cuales se desea proteger la marca.
4. El comprobante de pago de las tasas establecidas.

Si falta alguno de estos requisitos, la solicitud será considerada por la oficina nacional competente como no admitida a trámite y no se le asignará fecha de presentación."
"Artículo 143.- El solicitante de un registro de marca podrá pedir que se modifique la solicitud en cualquier momento del trámite. Del mismo modo podrá pedir la corrección de cualquier error material.

Asimismo, la oficina nacional competente podrá sugerir al solicitante modificaciones a la solicitud en cualquier momento del trámite. Dicha propuesta de modificación se tramitará de conformidad con lo establecido en el artículo 144.

En ningún caso la modificación podrá implicar el cambio de aspectos sustantivos del signo o la ampliación de los productos o servicios señalados inicialmente en la solicitud.

Si las normas nacionales lo permiten, se podrán establecer tasas para la solicitud de modificación.

Artículo 144.- La oficina nacional competente examinará, dentro de los 15 días contados a partir de la fecha de presentación de la solicitud, si las mismas cumplen con los requisitos de forma previstos en los artículos 135 y 136.

Si del examen de forma resulta que la solicitud no contiene los requisitos a los que hace referencia el párrafo precedente, la oficina nacional competente notificará al solicitante para que complete dichos requisitos dentro del plazo de sesenta días siguientes a la fecha de notificación.

Si a la expiración del término señalado, el solicitante no completa los requisitos indicados, la solicitud se considerará abandonada y perderá su prelación.

Artículo 145.- Si la solicitud de registro reúne los requisitos formales establecidos en el presente Capítulo, la oficina nacional competente ordenará la publicación.

Artículo 146.- Dentro del plazo de treinta días siguientes a la fecha de la publicación, quien tenga legítimo interés, podrá presentar, por una sola vez, oposición fundamentada que pueda desvirtuar el registro de la marca.

A solicitud de parte, la oficina nacional competente otorgará, por una sola vez un plazo adicional de treinta días para presentar las pruebas que sustenten la oposición.";Alta;Cuáles son los límites para las modificaciones en una solicitud de registro de marca según el contexto proporcionado?;"Según el contexto proporcionado, los límites para las modificaciones en una solicitud de registro de marca son:

1. La modificación no puede implicar cambios sustantivos en el signo.
2. No se permite la ampliación de los productos o servicios inicialmente señalados en la solicitud.

Estos límites están estipulados en el Artículo 143 del contexto proporcionado."
"Las oposiciones temerarias podrán ser sancionadas si así lo disponen las normas nacionales.

No procederán oposiciones contra la solicitud presentada, dentro de los seis meses posteriores al vencimiento del plazo de gracia a que se refiere el artículo 153, si tales oposiciones se basan en marcas que hubieren coexistido con la solicitada.

Artículo 147.- A efectos de lo previsto en el artículo anterior, se entenderá que también tienen legítimo interés para presentar oposiciones en los demás Países Miembros, tanto el titular de una marca idéntica o similar para productos o servicios, respecto de los cuales el uso de la marca pueda inducir al público a error, como quien primero solicitó el registro de esa marca en cualquiera de los Países Miembros. En ambos casos, el opositor deberá acreditar su interés real en el mercado del País

Miembro donde interponga la oposición, debiendo a tal efecto solicitar el registro de la marca al momento de interponerla.

La interposición de una oposición con base en una marca previamente registrada en cualquiera de los Países Miembros de conformidad con lo dispuesto en este artículo, facultará a la oficina nacional competente a denegar el registro de la segunda marca.

La interposición de una oposición con base en una solicitud de registro de marca previamente presentada en cualquiera de los Países Miembros de conformidad con lo dispuesto en este artículo, acarreará la suspensión del registro de la segunda marca, hasta tanto el registro de la primera sea conferido. En tal evento será de aplicación lo dispuesto en el párrafo precedente.

Artículo 148.- Si se hubiere presentado oposición, la oficina nacional competente notificará al solicitante para que dentro de los treinta días siguientes haga valer sus argumentaciones y presente pruebas, si lo estima conveniente.

A solicitud de parte, la oficina nacional competente otorgará, por una sola vez, un plazo adicional de treinta días para presentar las pruebas que sustenten la contestación.";Alta;Qué ocurre si se presenta oposición basada en una marca previamente registrada en algún país miembro?;"Si se presenta oposición basada en una marca previamente registrada en algún país miembro, la oficina nacional competente tendrá las siguientes acciones según el contexto proporcionado:

1. La oficina nacional competente denegará el registro de la segunda marca.

2. El solicitante de la segunda marca será notificado para que haga valer sus argumentaciones y presente pruebas dentro de los treinta días siguientes, si lo estima conveniente.

3. A solicitud de parte, la oficina nacional competente otorgará un plazo adicional de treinta días para presentar las pruebas que sustenten la contestación."
"Artículo 149.- La oficina nacional competente no considerará admitidas a trámite las oposiciones que estén comprendidas en alguno de los siguientes casos:

	que se presenten sin indicar los datos esenciales relativos al opositor y a la solicitud contra la cual se interpone la oposición;

	que la oposición fuere presentada extemporáneamente;

	que no haya pagado las tasas de tramitación correspondientes.

Artículo 150.- Vencido el plazo establecido en el artículo 148, o si no se hubiesen presentado oposiciones, la oficina nacional competente procederá a realizar el examen de registrabilidad. En caso se hubiesen presentado oposiciones, la oficina nacional competente se pronunciará sobre éstas y sobre la concesión o denegatoria del registro de la marca mediante resolución.

Artículo 151.- Para clasificar los productos y los servicios a los cuales se aplican las marcas, los Países Miembros utilizarán la Clasificación Internacional de Productos y Servicios para el Registro de las Marcas, establecida por el Arreglo de Niza del 15 de junio de 1957, con sus modificaciones vigentes.

Las clases de la Clasificación Internacional referida en el párrafo anterior no determinarán la similitud ni la disimilitud de los productos o servicios indicados expresamente.

CAPITULO III

De los Derechos y Limitaciones conferidos por la Marca

Artículo 152.- El registro de una marca tendrá una duración de diez años contados a partir de la fecha de su concesión y podrá renovarse por períodos sucesivos de diez años.";Alta;Cuáles son los casos en los que la oficina nacional competente no considerará admitidas a trámite las oposiciones?;"Según el contexto proporcionado, la oficina nacional competente no considerará admitidas a trámite las oposiciones en tres casos específicos:

1. Cuando se presenten sin indicar los datos esenciales relativos al opositor y a la solicitud contra la cual se interpone la oposición.
2. Cuando la oposición fuere presentada extemporáneamente.
3. Cuando no haya pagado las tasas de tramitación correspondientes."
"Artículo 153.- El titular del registro, o quien tuviere legítimo interés, deberá solicitar la renovación del registro ante la oficina nacional competente, dentro de los seis meses anteriores a la expiración del registro. No obstante, tanto el titular del registro como quien tuviere legítimo interés gozarán de un plazo de gracia de seis meses, contados a partir de la fecha de vencimiento del registro, para solicitar su renovación. A tal efecto acompañará los comprobantes de pago de las tasas establecidas, pagando conjuntamente el recargo correspondiente si así lo permiten las normas internas de los Países Miembros. Durante el plazo referido, el registro de marca mantendrá su plena vigencia.

A efectos de la renovación no se exigirá prueba de uso de la marca y se renovará de manera automática, en los mismos términos del registro original. Sin embargo, el titular podrá reducir o limitar los productos o servicios indicados en el registro original.

Artículo 154.- El derecho al uso exclusivo de una marca se adquirirá por el registro de la misma ante la respectiva oficina nacional competente.

Artículo 155.- El registro de una marca confiere a su titular el derecho de impedir a cualquier tercero realizar, sin su consentimiento, los siguientes actos:

		aplicar o colocar la marca o un signo distintivo idéntico o semejante sobre productos para los cuales se ha registrado la marca; sobre productos vinculados a los servicios para los cuales ésta se ha registrado; o sobre los envases, envolturas, embalajes o acondicionamientos de tales productos;

		suprimir o modificar la marca con fines comerciales, después de que se hubiese aplicado o colocado sobre los productos para los cuales se ha registrado la marca; sobre los productos vinculados a los servicios para los cuales ésta se ha registrado; o sobre los envases, envolturas, embalajes o acondicionamientos de tales productos;";Alta;Cuál es el plazo para solicitar la renovación del registro de una marca y qué ocurre si se excede este plazo?;El titular del registro o quien tuviere legítimo interés deberá solicitar la renovación del registro dentro de los seis meses anteriores a la expiración del mismo. Si se excede este plazo, aún gozarán de un plazo de gracia de seis meses, contados a partir de la fecha de vencimiento del registro, para realizar esta solicitud. Durante este período de gracia, el registro de marca mantendrá su plena vigencia.
"fabricar etiquetas, envases, envolturas, embalajes u otros materiales que reproduzcan o contengan la marca, así como comercializar o detentar tales materiales;

		usar en el comercio un signo idéntico o similar a la marca respecto de cualesquiera productos o servicios, cuando tal uso pudiese causar confusión o un riesgo de asociación con el titular del registro. Tratándose del uso de un signo idéntico para productos o servicios idénticos se presumirá que existe riesgo de confusión;

		usar en el comercio un signo idéntico o similar a una marca notoriamente conocida respecto de cualesquiera productos o servicios, cuando ello pudiese causar al titular del registro un daño económico o comercial injusto por razón de una dilución de la fuerza distintiva o del valor comercial o publicitario de la marca, o por razón de un aprovechamiento injusto del prestigio de la marca o de su titular;

		usar públicamente un signo idéntico o similar a una marca notoriamente conocida, aun para fines no comerciales, cuando ello pudiese causar una dilución de la fuerza distintiva o del valor comercial o publicitario de la marca, o un aprovechamiento injusto de su prestigio.

Artículo 156.- A efectos de lo previsto en los literales e) y f) del artículo anterior, constituirán uso de un signo en el comercio por parte de un tercero, entre otros, los siguientes actos:

		introducir en el comercio, vender, ofrecer en venta o distribuir productos o servicios con ese signo;

	importar, exportar, almacenar o transportar productos con ese signo; o,

		emplear el signo en publicidad, publicaciones, documentos comerciales o comunicaciones escritas u orales, independientemente del medio de comunicación empleado y sin perjuicio de las normas sobre publicidad que fuesen aplicables.";Alta;Cuáles son los actos considerados como uso de un signo en el comercio según el artículo 156 mencionado?;"Según el artículo 156 mencionado, los actos considerados como uso de un signo en el comercio por parte de un tercero incluyen:

- Introducir en el comercio productos o servicios con ese signo.
- Vender productos o servicios con ese signo.
- Ofrecer en venta productos o servicios con ese signo.
- Distribuir productos o servicios con ese signo.
- Importar productos con ese signo.
- Exportar productos con ese signo.
- Almacenar productos con ese signo.
- Transportar productos con ese signo.
- Emplear el signo en publicidad.
- Emplear el signo en publicaciones.
- Emplear el signo en documentos comerciales.
- Emplear el signo en comunicaciones escritas u orales.

Estos actos pueden realizarse independientemente del medio de comunicación empleado y sin perjuicio de las normas sobre publicidad que fuesen aplicables."
"Artículo 157.- Los terceros podrán, sin consentimiento del titular de la marca registrada, utilizar en el mercado su propio nombre, domicilio o seudónimo, un nombre geográfico o cualquier otra indicación cierta relativa a la especie, calidad, cantidad, destino, valor, lugar de origen o época de producción de sus productos o de la prestación de sus servicios u otras características de éstos; siempre que ello se haga de buena fe, no constituya uso a título de marca, y tal uso se limite a propósitos de identificación o de información y no sea capaz de inducir al público a confusión sobre la procedencia de los productos o servicios.

El registro de la marca no confiere a su titular, el derecho de prohibir a un tercero usar la marca para anunciar, inclusive en publicidad comparativa, ofrecer en venta o indicar la existencia o disponibilidad de productos o servicios legítimamente marcados; o para indicar la compatibilidad o adecuación de piezas de recambio o de accesorios utilizables con los productos de la marca registrada, siempre que tal uso sea de buena fe, se limite al propósito de información al público y no sea susceptible de inducirlo a confusión sobre el origen empresarial de los productos o servicios respectivos.

Artículo 158.- El registro de una marca no dará el derecho de impedir a un tercero realizar actos de comercio respecto de un producto protegido por dicho registro, después de que ese producto se hubiese introducido en el comercio en cualquier país por el titular del registro o por otra persona con consentimiento del titular o económicamente vinculada a él, en particular cuando los productos y los envases o embalajes que estuviesen en contacto directo con ellos no hubiesen sufrido ninguna modificación, alteración o deterioro.";Alta;Qué actividades puede realizar un tercero sin el consentimiento del titular de la marca registrada según los artículos 157 y 158?;"Según los artículos 157 y 158 proporcionados, un tercero puede realizar las siguientes actividades sin el consentimiento del titular de la marca registrada:

1. **Artículo 157:**
   - Utilizar en el mercado su propio nombre, domicilio o seudónimo.
   - Usar un nombre geográfico u otra indicación cierta relativa a características específicas de los productos o servicios (especie, calidad, cantidad, destino, valor, lugar de origen, época de producción).
   - Estas actividades deben realizarse con buena fe y limitarse al propósito de identificación o información. Además, no deben inducir al público a confusión sobre la procedencia de los productos o servicios.

2. **Artículo 158:**
   - Anunciar, ofrecer en venta o indicar la existencia o disponibilidad de productos legítimamente marcados por el titular.
   - Indicar la compatibilidad o adecuación de piezas de recambio o accesorios utilizables con los productos de la marca registrada.
   - Estas actividades también deben realizarse con buena fe, limitarse al propósito de información al público y no ser susceptibles de inducir a confusión sobre el origen empresarial.

Estos derechos se extienden siempre que las acciones del tercero no constituyan un uso a título de marca ni puedan causar confusión en el público."
"A los efectos del párrafo precedente, se entenderá que dos personas están económicamente vinculadas cuando una pueda ejercer directa o indirectamente sobre la otra una influencia decisiva con respecto a la explotación de los derechos sobre la marca, o cuando un tercero puede ejercer tal influencia sobre ambas personas.

Artículo 159.- Cuando en la Subregión existan registros sobre una marca idéntica o similar a nombre de titulares diferentes, para distinguir los mismos productos o servicios, se prohibe la comercialización de las mercancías o servicios identificados con esa marca en el territorio del respectivo País Miembro, salvo que los titulares de dichas marcas suscriban acuerdos que permitan dicha comercialización.

En caso de llegarse a tales acuerdos, las partes deberán adoptar las previsiones necesarias para evitar la confusión del público respecto del origen de las mercancías o servicios de que se trate, incluyendo lo relativo a la identificación del origen de los

productos o servicios en cuestión con caracteres destacados y proporcionales a los mismos para la debida información al público consumidor. Esos acuerdos deberán inscribirse en las oficinas nacionales competentes y respetar las normas sobre prácticas comerciales y promoción de la competencia.

En cualquier caso, no se prohibirá la importación de un producto o servicio que se encuentre en la situación descrita en el primer párrafo de este artículo, cuando la marca no esté siendo utilizada en el territorio del país importador, según lo dispuesto en el primer párrafo del artículo 166, salvo que el titular de dicha marca demuestre ante la oficina nacional competente, que la no utilización de la marca obedece a causas justificadas.

Artículo 160.- Cuando la marca conste de un nombre geográfico, no podrá comercializarse el producto sin indicarse en éste, en forma visible y claramente legible, el lugar de fabricación del producto.

CAPITULO IV

De las Licencias y Transferencias de las Marcas";Alta;Cuáles son las obligaciones para evitar la confusión del público cuando titulares diferentes tienen marcas idénticas o similares en la Subregión?;"Según el contexto proporcionado, cuando titulares diferentes tienen marcas idénticas o similares en la Subregión y comercializan productos o servicios que son iguales o similares, las obligaciones para evitar la confusión del público son:

1. Los titulares deben suscribir acuerdos que permitan dicha comercialización.
2. Deben adoptar medidas necesarias para evitar la confusión del público respecto al origen de los productos o servicios en cuestión.
3. Es necesario identificar el origen de los productos o servicios con caracteres destacados y proporcionales a los mismos, para informar adecuadamente al público consumidor.
4. Estos acuerdos deben inscribirse en las oficinas nacionales competentes y deberán respetar las normas sobre prácticas comerciales y promoción de la competencia.

Estas medidas son esenciales para garantizar que el público no se confunda respecto al origen o propiedad de los productos o servicios."
"Artículo 161.- Un registro de marca concedido o en trámite de registro podrá ser transferido por acto entre vivos o por vía sucesoria, con o sin la empresa a la cual pertenece.

Deberá registrarse ante la oficina nacional competente toda transferencia del registro de marca. La falta de registro ocasionará que la transferencia no surta efectos frente a terceros.

A efectos del registro, la transferencia deberá constar por escrito.

Cualquier persona interesada podrá solicitar el registro de una transferencia. No obstante, la oficina nacional competente podrá denegar dicho registro, si la transferencia acarreara riesgo de confusión.

Artículo 162.- El titular de una marca registrada o en trámite de registro podrá dar licencia a uno o más terceros para la explotación de la marca respectiva.

Deberá registrarse ante la oficina nacional competente toda licencia de uso de la marca. La falta de registro ocasionará que la licencia no surta efectos frente a terceros.

A efectos del registro, la licencia deberá constar por escrito.

Cualquier persona interesada podrá solicitar el registro de una licencia.

Artículo 163.- La autoridad nacional competente no registrará los contratos de licencia o transferencia de registro de marcas que no se ajusten a las disposiciones del Régimen Común de Tratamiento a los Capitales Extranjeros y sobre Marcas, Patentes, Licencias y Regalías, o a las disposiciones comunitarias y nacionales sobre prácticas comerciales restrictivas de la libre competencia.

Artículo 164.- En caso exista algún cambio respecto al nombre o dirección del titular del registro de marca durante el plazo de vigencia de la licencia, el titular del

registro deberá informarlo a la oficina nacional competente. En caso contrario, cualquier notificación realizada conforme a los datos que figuren en el registro, se reputará válida.

CAPITULO V

De la Cancelación del Registro";Alta;Qué ocurre si no se registra una transferencia o licencia de uso de marca ante la oficina nacional competente?;Si no se registra una transferencia o licencia de uso de marca ante la oficina nacional competente, la falta de registro ocasionará que dicha transferencia o licencia no surta efectos frente a terceros. Es decir, aunque se haya realizado un acto de transferencia o se haya dado una licencia, estos cambios no tendrán validez legal y no protegerán al nuevo titular o al tercero con el derecho de uso de la marca, a menos que se realice el registro correspondiente ante la oficina nacional competente.
