context;importance;human;response
"En cualquier caso, no se prohibirá la importación de un producto o servicio que se encuentre en la situación descrita en el primer párrafo de este artículo, cuando la marca no esté siendo utilizada en el territorio del país importador, según lo dispuesto en el primer párrafo del artículo 166, salvo que el titular de dicha marca demuestre ante la oficina nacional competente, que la no utilización de la marca obedece a causas justificadas.

Artículo 160.- Cuando la marca conste de un nombre geográfico, no podrá comercializarse el producto sin indicarse en éste, en forma visible y claramente legible, el lugar de fabricación del producto.

CAPITULO IV

De las Licencias y Transferencias de las Marcas

Artículo 161.- Un registro de marca concedido o en trámite de registro podrá ser transferido por acto entre vivos o por vía sucesoria, con o sin la empresa a la cual pertenece.

Deberá registrarse ante la oficina nacional competente toda transferencia del registro de marca. La falta de registro ocasionará que la transferencia no surta efectos frente a terceros.

A efectos del registro, la transferencia deberá constar por escrito.

Cualquier persona interesada podrá solicitar el registro de una transferencia. No obstante, la oficina nacional competente podrá denegar dicho registro, si la transferencia acarreara riesgo de confusión.

Artículo 162.- El titular de una marca registrada o en trámite de registro podrá dar licencia a uno o más terceros para la explotación de la marca respectiva.

Deberá registrarse ante la oficina nacional competente toda licencia de uso de la marca. La falta de registro ocasionará que la licencia no surta efectos frente a terceros.

A efectos del registro, la licencia deberá constar por escrito.

Cualquier persona interesada podrá solicitar el registro de una licencia.

Artículo 163.- La autoridad nacional competente no registrará los contratos de licencia o transferencia de registro de marcas que no se ajusten a las disposiciones del Régimen Común de Tratamiento a los Capitales Extranjeros y sobre Marcas, Patentes, Licencias y Regalías, o a las disposiciones comunitarias y nacionales sobre prácticas comerciales restrictivas de la libre competencia.

Artículo 164.- En caso exista algún cambio respecto al nombre o dirección del titular del registro de marca durante el plazo de vigencia de la licencia, el titular del

registro deberá informarlo a la oficina nacional competente. En caso contrario, cualquier notificación realizada conforme a los datos que figuren en el registro, se reputará válida.

CAPITULO V

De la Cancelación del Registro

Artículo 165.- La oficina nacional competente cancelará el registro de una marca a solicitud de persona interesada, cuando sin motivo justificado la marca no se hubiese utilizado en al menos uno de los Países Miembros, por su titular, por un licenciatario o por otra persona autorizada para ello durante los tres años consecutivos precedentes a la fecha en que se inicie la acción de cancelación. La cancelación de un registro por falta de uso de la marca también podrá solicitarse como defensa en un procedimiento de oposición interpuestos con base en la marca no usada.

No obstante lo previsto en el párrafo anterior, no podrá iniciarse la acción de cancelación antes de transcurridos tres años contados a partir de la fecha de notificación de la resolución que agote el procedimiento de registro de la marca respectiva en la vía administrativa.

Cuando la falta de uso de una marca sólo afectara a uno o a algunos de los productos o servicios para los cuales estuviese registrada la marca, se ordenará una reducción o limitación de la lista de los productos o servicios comprendidos en el registro de la marca, eliminando aquéllos respecto de los cuales la marca no se hubiese usado; para ello se tomará en cuenta la identidad o similitud de los productos o servicios.";Alta;Cuáles son las condiciones bajo las cuales el registro de transferencia o licencia de una marca no surtirá efectos frente a terceros?;"Según el contexto proporcionado, el registro de transferencia o licencia de una marca no surtirá efectos frente a terceros si se presenta la falta de registro ante la oficina nacional competente. Específicamente, los artículos 161 y 162 establecen que:

- La transferencia del registro de marca debe registrarse ante la oficina nacional para que surta efectos.
- De igual manera, cualquier licencia de uso de la marca también requiere un registro ante dicha oficina para tener validez frente a terceros.

Así, el cumplimiento de esta formalidad registral es crucial para que las transferencias y licencias tengan efectividad legal."
"El registro no podrá cancelarse cuando el titular demuestre que la falta de uso se debió, entre otros, a fuerza mayor o caso fortuito.

Artículo 166.- Se entenderá que una marca se encuentra en uso cuando los productos o servicios que ella distingue han sido puestos en el comercio o se encuentran disponibles en el mercado bajo esa marca, en la cantidad y del modo que normalmente corresponde, teniendo en cuenta la naturaleza de los productos o servicios y las modalidades bajo las cuales se efectúa su comercialización en el mercado.

También se considerará usada una marca, cuando distinga exclusivamente productos que son exportados desde cualquiera de los Países Miembros, según lo establecido en el párrafo anterior.

El uso de una marca en modo tal que difiera de la forma en que fue registrada sólo en cuanto a detalles o elementos que no alteren su carácter distintivo, no motivará la cancelación del registro por falta de uso, ni disminuirá la protección que corresponda a la marca.

Artículo 167.- La carga de la prueba del uso de la marca corresponderá al titular del registro.

El uso de la marca podrá demostrarse mediante facturas comerciales, documentos contables o certificaciones de auditoría que demuestren la regularidad y la cantidad de la comercialización de las mercancías identificadas con la marca, entre otros.

Artículo 168.- La persona que obtenga una resolución favorable tendrá derecho preferente al registro. Dicho derecho podrá invocarse a partir de la presentación de la solicitud de cancelación, y hasta dentro de los tres meses siguientes de la fecha en que la resolución de cancelación quede firme en la vía administrativa.

Artículo 169.- La oficina nacional competente, decretará de oficio o a solicitud de cualquier persona, la cancelación del registro de una marca o la limitación de su alcance cuando su titular hubiese provocado o tolerado que ella se convierta en un signo común o genérico para identificar o designar uno o varios de los productos o servicios para los cuales estuviese registrada.

Se entenderá que una marca se ha convertido en un signo común o genérico cuando en los medios comerciales y para el público dicha marca haya perdido su carácter distintivo como indicación de procedencia empresarial del producto o servicio al cual se aplica. Para estos efectos deberán concurrir los siguientes hechos con relación a esa marca:

		la necesidad que tuvieran los competidores de usar el signo para poder desarrollar sus actividades por no existir otro nombre o signo adecuado para designar o identificar en el comercio al producto o servicio respectivo;

		el uso generalizado de la marca por el público y en los medios comerciales como signo común o genérico del producto o servicio respectivo; y

		el desconocimiento o bajo reconocimiento por el público de que la marca significa una procedencia empresarial determinada.

Artículo 170.- Recibida una solicitud de cancelación, la oficina nacional competente notificará al titular de la marca registrada para que dentro del plazo de sesenta días hábiles contados a partir de la notificación, haga valer los alegatos y las pruebas que estime convenientes.

Vencidos los plazos a los que se refiere este artículo, la oficina nacional competente decidirá sobre la cancelación o no del registro de la marca, lo cual notificará a las partes, mediante resolución.

CAPITULO VI

De la Renuncia al Registro

Artículo 171.- El titular de un registro de marca podrá renunciar en cualquier momento a sus derechos sobre el registro.

Cuando la renuncia fuese parcial, ella abarcará los productos o servicios objeto de la renuncia.

No se admitirá la renuncia si sobre la marca existen embargos o derechos reales de garantía inscritos en la oficina nacional competente, salvo que exista consentimiento expreso de los titulares de dichos derechos.

La renuncia al registro de la marca surtirá efectos a partir de su inscripción ante la oficina nacional competente.

CAPITULO VII

De la Nulidad del Registro";Alta;Qué circunstancias permiten mantener el registro de una marca aunque no se haya utilizado durante un período determinado?;"Según el contexto proporcionado, se pueden mantener los derechos sobre un registro de marca incluso si no se ha utilizado durante un período determinado en las siguientes circunstancias:

1. Si el titular demuestra que la falta de uso se debió a fuerza mayor o caso fortuito.

Esto significa que si el titular puede probar que la razón para no haber usado la marca fue debido a circunstancias imprevistas y fuera de su control, como un desastre natural o una pandemia (por ejemplo), esto podría permitir mantener el registro sin haber utilizado la marca durante cierto tiempo.

2. Si se demuestra el uso de la marca en los Países Miembros para productos exportados, aunque estos productos no hayan sido puestos directamente en el comercio del país donde se registra la marca.

3. El uso de la marca que difiera ligeramente de la forma registrada pero sin alterar su carácter distintivo, no motivará la cancelación por falta de uso y no disminuirá la protección a la marca.

Estas circunstancias permiten mantener el registro de una marca si se demuestran adecuadamente, asegurando que los derechos sobre la marca siguen siendo válidos."
"Artículo 172.- La autoridad nacional competente decretará de oficio o a solicitud de cualquier persona y en cualquier momento, la nulidad absoluta de un registro de marca cuando se hubiese concedido en contravención con lo dispuesto en los artículos 134 primer párrafo y 135.

La autoridad nacional competente decretará de oficio o a solicitud de cualquier persona, la nulidad relativa de un registro de marca cuando se hubiese concedido en contravención de lo dispuesto en el artículo 136 o cuando éste se hubiera efectuado de mala fe. Esta acción prescribirá a los cinco años contados desde la fecha de concesión del registro impugnado.

Las acciones precedentes no afectarán las que pudieran corresponder por daños y perjuicios conforme a la legislación interna.

No podrá declararse la nulidad del registro de una marca por causales que hubiesen dejado de ser aplicables al tiempo de resolverse la nulidad.

Cuando una causal de nulidad sólo se aplicara a uno o a algunos de los productos o servicios para los cuales la marca fue registrada, se declarará la nulidad únicamente para esos productos o servicios, y se eliminarán del registro de la marca.

Artículo 173.- Serán de aplicación al presente Capítulo las disposiciones del artículo 78.

CAPITULO VIII

De la Caducidad del Registro

Artículo 174.- El registro de la marca caducará de pleno derecho si el titular o quien tuviera legítimo interés no solicita la renovación dentro del término legal, incluido el período de gracia, de acuerdo con lo establecido en la presente Decisión.

Asimismo, será causal de caducidad la falta de pago de las tasas, en los términos que determine la legislación nacional del País Miembro.

TITULO VII

DE LOS LEMAS COMERCIALES

Artículo 175.- Los Países Miembros podrán registrar como marca los lemas comerciales, de conformidad con sus respectivas legislaciones nacionales.

Se entiende por lema comercial la palabra, frase o leyenda utilizada como complemento de una marca.

Artículo 176.- La solicitud de registro de un lema comercial deberá especificar la marca solicitada o registrada con la cual se usará.

Artículo 177.- No podrán registrarse lemas comerciales que contengan alusiones a productos o marcas similares o expresiones que puedan perjudicar a dichos productos o marcas.

Artículo 178.- Un lema comercial deberá ser transferido conjuntamente con el signo marcario al cual se asocia y su vigencia estará sujeta a la del signo.

Artículo 179.- Serán aplicables a este Título, en lo pertinente, las disposiciones relativas al Título de Marcas de la presente Decisión.

TITULO VIII

DE LAS MARCAS COLECTIVAS

Artículo 180.- Se entenderá por marca colectiva todo signo que sirva para distinguir el origen o cualquier otra característica común de productos o servicios pertenecientes a empresas diferentes y que lo utilicen bajo el control de un titular.

Artículo 181.- Las asociaciones de productores, fabricantes, prestadores de servicios, organizaciones o grupos de personas, legalmente establecidos, podrán solicitar el registro de marca colectiva para distinguir en el mercado los productos o servicios de sus integrantes.

Artículo 182.- La solicitud de registro deberá indicar que se trata de una marca colectiva e ir acompañada de:

	copia de los estatutos de la asociación, organización o grupo de personas que solicite el registro de la marca colectiva;

	la lista de integrantes; y,

	la indicación de las condiciones y la forma cómo la marca colectiva debe utilizarse en los productos o servicios.

Una vez obtenido el registro de marca colectiva, la asociación, organización o grupo de personas deberá informar a la oficina nacional competente cualquier cambio que se produzca en cualquiera de los documentos a que hace referencia el presente artículo.

Artículo 183.- La marca colectiva podrá ser transferida o licenciada de conformidad con lo previsto en las normas internas de la asociación, organización o grupo de personas.";Alta;Cuáles son las causales que pueden llevar a la nulidad absoluta del registro de una marca según el artículo 172?;Según el artículo 172, la nulidad absoluta de un registro de marca puede declararse cuando se hubiese concedido en contravención con lo dispuesto en los artículos 134 primer párrafo y 135.
"Las transferencias y licencias deberán ser inscritas ante la oficina nacional competente para que surtan efectos frente a terceros.

Artículo 184.- Serán aplicables a este Título, en lo pertinente, las disposiciones relativas al Título de Marcas de la presente Decisión.

TITULO IX

DE LAS MARCAS DE CERTIFICACIÓN

Artículo 185.- Se entenderá por marca de certificación un signo destinado a ser aplicado a productos o servicios cuya calidad u otras características han sido certificadas por el titular de la marca.

Artículo 186.- Podrá ser titular de una marca de certificación una empresa o institución, de derecho privado o público o un organismo estatal, regional o internacional.

Artículo 187.- Con la solicitud de registro de una marca de certificación deberá acompañarse el reglamento de uso de la marca que indique los productos o servicios que podrán ser objeto de certificación por su titular; defina las características garantizadas por la presencia de la marca; y describa la manera en que se ejercerá el control de tales características antes y después de autorizarse el uso de la marca.

El reglamento de uso se inscribirá junto con la marca.

Toda modificación de las reglas de uso de la marca de certificación deberá ser puesta en conocimiento de la oficina nacional competente. La modificación de las reglas de uso surtirá efectos frente a terceros a partir de su inscripción en el registro correspondiente.

Artículo 188.- El titular de una marca de certificación podrá autorizar su uso a cualquier persona cuyo producto o servicio cumpla las condiciones establecidas en el reglamento de uso de la marca.

La marca de certificación no podrá usarse en relación con productos o servicios producidos, prestados o comercializados por el propio titular de la marca.

Artículo 189.- Serán aplicables a este Título, en lo pertinente, las disposiciones relativas al Título de Marcas de la presente Decisión.

TITULO X

DEL NOMBRE COMERCIAL

Artículo 190.- Se entenderá por nombre comercial cualquier signo que identifique a una actividad económica, a una empresa, o a un establecimiento mercantil.

Una empresa o establecimiento podrá tener más de un nombre comercial. Puede constituir nombre comercial de una empresa o establecimiento, entre otros, su denominación social, razón social u otra designación inscrita en un registro de personas o sociedades mercantiles.

Los nombres comerciales son independientes de las denominaciones o razones sociales de las personas jurídicas, pudiendo ambas coexistir.

Artículo 191.- El derecho exclusivo sobre un nombre comercial se adquiere por su primer uso en el comercio y termina cuando cesa el uso del nombre o cesan las actividades de la empresa o del establecimiento que lo usa.

Artículo 192.- El titular de un nombre comercial podrá impedir a cualquier tercero usar en el comercio un signo distintivo idéntico o similar, cuando ello pudiere causar confusión o un riesgo de asociación con la empresa del titular o con sus productos o servicios. En el caso de nombres comerciales notoriamente conocidos, cuando asimismo pudiera causarle un daño económico o comercial injusto, o implicara un aprovechamiento injusto del prestigio del nombre o de la empresa del titular.

Será aplicable al nombre comercial lo dispuesto en los artículos 155, 156, 157 y 158 en cuanto corresponda.

Artículo 193.- Conforme a la legislación interna de cada País Miembro, el titular de un nombre comercial podrá registrarlo o depositarlo ante la oficina nacional competente. El registro o depósito tendrá carácter declarativo. El derecho a su uso exclusivo solamente se adquirirá en los términos previstos en el artículo 191.

Artículo 194.- No podrá registrarse como nombre comercial un signo que esté comprendido en alguno de los casos siguientes:

		cuando consista, total o parcialmente, en un signo contrario a la moral o al orden público;";Alta;Qué acciones deben realizarse para que surtan efectos las transferencias y licencias de marcas frente a terceros?;Para que surtan efectos las transferencias y licencias de marcas frente a terceros, se debe inscribir la transacción ante la oficina nacional competente.
"cuando su uso sea susceptible de causar confusión en los medios comerciales o en el público sobre la identidad, la naturaleza, las actividades, el giro comercial o cualquier otro aspecto de la empresa o establecimiento designado con ese nombre;

		cuando su uso sea susceptible de causar confusión en los medios comerciales o en el público sobre la procedencia empresarial, el origen u otras características de los productos o servicios que la empresa produzca o comercialice; o,

	cuando exista una solicitud o registro de nombre comercial anterior.

Artículo 195.- Para efectos del registro, la oficina nacional competente examinará si el nombre comercial contraviene lo dispuesto en el artículo anterior. Los Países Miembros podrán exigir la prueba de uso, conforme a sus normas nacionales.

Podrá ser aplicable al registro del nombre comercial la clasificación de productos y servicios utilizadas para las marcas.

Artículo 196.- En caso de registro del nombre comercial, éste tendrá una duración de diez años contados a partir de la fecha de su registro o depósito, renovables por períodos iguales.

Artículo 197.- El titular de un registro de nombre comercial podrá renunciar a sus derechos sobre el registro. La renuncia al registro del nombre comercial surtirá efectos a partir de su inscripción ante la oficina nacional competente.

Artículo 198.- La renovación del registro de un nombre comercial deberá solicitarse ante la oficina nacional competente, dentro de los seis meses anteriores a la fecha de su expiración. No obstante, el titular del nombre comercial gozará de un plazo de gracia de seis meses, contados a partir de la fecha de vencimiento del registro para solicitar su renovación, acompañando los comprobantes de pago de las tasas establecidas en las normas internas de los Países Miembros, pagando conjuntamente el recargo establecido, de ser el caso. Durante el plazo referido, el registro del nombre comercial mantendrá su plena vigencia.

A efectos de la renovación las oficinas nacionales competentes podrán exigir prueba de uso del nombre comercial conforme a sus normas nacionales. En todo caso el registro se efectuará en los mismos términos del registro original.

Artículo 199.- La transferencia de un nombre comercial registrado o depositado se inscribirá ante la oficina nacional competente de acuerdo con el procedimiento aplicable a la transferencia de marcas, en cuanto corresponda, y devengará la misma tasa. Sin perjuicio de ello, la transferencia del nombre comercial sólo podrá efectuarse conjuntamente con la de la empresa o establecimiento con el cual se venía usando.

El nombre comercial podrá ser objeto de licencia. Cuando lo prevean las normas nacionales, dicha licencia podrá ser registrada ante la oficina nacional competente.

TITULO XI

DE LOS RÓTULOS O ENSEÑAS

Artículo 200.- La protección y depósito de los rótulos o enseñas se regirá por las disposiciones relativas al nombre comercial, conforme a las normas nacionales de cada País Miembro.

TITULO XII

DE LAS INDICACIONES GEOGRÁFICAS

CAPITULO I

De las Denominaciones de Origen

Artículo 201.- Se entenderá por denominación de origen, una indicación geográfica constituida por la denominación de un país, de una región o de un lugar determinado, o constituida por una denominación que sin ser la de un país, una región o un lugar determinado se refiere a una zona geográfica determinada, utilizada para designar un producto originario de ellos y cuya calidad, reputación u otras características se deban exclusiva o esencialmente al medio geográfico en el cual se produce, incluidos los factores naturales y humanos.

Artículo 202.- No podrán ser declaradas como denominaciones de origen, aquellas que:

	no se ajusten a la definición contenida en el artículo 201;

		sean indicaciones comunes o genéricas para distinguir el producto de que se trate, entendiéndose por ello las consideradas como tales tanto por los conocedores de la materia como por el público en general;";Alta;Cuándo no podrán ser declaradas como denominaciones de origen las indicaciones geográficas según el contexto proporcionado?;"Según el contexto proporcionado, no podrán ser declaradas como denominaciones de origen aquellas que:

- No se ajusten a la definición contenida en el artículo 201.
- Sean indicaciones comunes o genéricas para distinguir el producto de que se trate, entendiendo por ello las consideradas como tales tanto por los conocedores de la materia como por el público en general."
