context;importance;human;response
"sean contrarias a las buenas costumbres o al orden público; o,

		puedan inducir a error al público sobre la procedencia geográfica, la naturaleza, el modo de fabricación, o la calidad, reputación u otras características de los respectivos productos.

Artículo 203.- La declaración de protección de una denominación de origen se hará de oficio o a petición de quienes demuestren tener legítimo interés, entendiéndose por tales, las personas naturales o jurídicas que directamente se dediquen a la extracción, producción o elaboración del producto o los productos que se pretendan amparar con la denominación de origen, así como las asociaciones de productores. Las autoridades estatales, departamentales, provinciales o municipales también se considerarán interesadas, cuando se trate de denominaciones de origen de sus respectivas circunscripciones.

Artículo 204.- La solicitud de declaración de protección de una denominación de origen se hará por escrito ante la oficina nacional competente, debiendo indicar:

	nombre, domicilio, residencia y nacionalidad del o los solicitantes, así como la demostración de su legítimo interés;

	la denominación de origen objeto de la declaración;

	la zona geográfica delimitada de producción, extracción o elaboración del producto que se designa con la denominación de origen;

	los productos designados por la denominación de origen; y,

	una reseña de las calidades, reputación u otras características esenciales de los productos designados por la denominación de origen.

Artículo 205.- Admitida la solicitud, la oficina nacional competente analizará, dentro de los treinta días siguientes, si cumple con los requisitos previstos en el presente Título y los establecidos por las legislaciones internas de los Países Miembros, siguiendo posteriormente el procedimiento relativo al examen de forma de la marca, en lo que fuera pertinente.

Artículo 206.- La vigencia de la declaración de protección de una denominación de origen, estará determinada por la subsistencia de las condiciones que la motivaron, a juicio de la oficina nacional competente. Dicha oficina podrá declarar el término de su vigencia si tales condiciones no se mantuvieran. No obstante, los interesados podrán solicitarla nuevamente cuando consideren que se han restituido las condiciones para su protección, sin perjuicio de los recursos administrativos previstos en las legislaciones internas de los Países Miembros.

La declaración de protección de la denominación de origen podrá ser modificada en cualquier tiempo cuando cambie cualquiera de los elementos referidos en el artículo

204. La modificación se sujetará al procedimiento previsto para la declaración de protección, en cuanto corresponda.

Artículo 207.- La autorización de uso de una denominación de origen protegida deberá ser solicitada por las personas que:

	directamente se dediquen a la extracción, producción o elaboración de los productos distinguidos por la denominación de origen;

	realicen dicha actividad dentro de la zona geográfica delimitada según la declaración de protección; y,

	cumplan con otros requisitos establecidos por las oficinas nacionales competentes.

Artículo 208.- La oficina nacional competente podrá otorgar las autorizaciones de uso correspondientes. La autorización de uso también podrá ser concedida por las entidades públicas o privadas que representen a los beneficiarios de las denominaciones de origen, si así lo establecen las normas nacionales.

Artículo 209.- Cuando la autorización de uso sea competencia de la oficina nacional competente, ella será otorgada o denegada en un lapso de quince días contados a partir de la fecha de presentación de la solicitud.

Artículo 210.- La autorización de uso de una denominación de origen protegida tendrá una duración de diez años, pudiendo ser renovada por períodos iguales, de conformidad con el procedimiento para la renovación de marcas establecido en la presente Decisión.";Alta;Qué información debe incluirse en la solicitud de declaración de protección de una denominación de origen según el contexto proporcionado?;"Según el contexto proporcionado, la solicitud de declaración de protección de una denominación de origen debe incluir lo siguiente:

- Nombre, domicilio, residencia y nacionalidad del o los solicitantes.
- La denominación de origen objeto de la declaración.
- La zona geográfica delimitada de producción, extracción o elaboración del producto que se designa con la denominación de origen.
- Los productos designados por la denominación de origen.
- Una reseña de las calidades, reputación u otras características esenciales de los productos designados por la denominación de origen."
"Artículo 211.- La autorización de uso de una denominación de origen protegida, caducará si no se solicita su renovación dentro de los plazos previstos para la renovación de marcas de la presente Decisión.

De la misma forma, será motivo de caducidad la falta de pago de las tasas, en los términos que acuerde la legislación nacional de cada País Miembro.

Artículo 212.- La utilización de denominaciones de origen con relación a los productos naturales, agrícolas, artesanales o industriales provenientes de los Países Miembros, queda reservada exclusivamente para los productores, fabricantes y artesanos que tengan sus establecimientos de producción o de fabricación en la localidad o región del País Miembro designada o evocada por dicha denominación.

Solamente los productores, fabricantes o artesanos autorizados a usar una denominación de origen registrada podrán emplear junto con ella la expresión ""DENOMINACION DE ORIGEN"".

Son aplicables a las denominaciones de origen protegidas las disposiciones de los Artículos 155, 156, 157 y 158, en cuanto corresponda.

Artículo 213.- Las entidades públicas o privadas que representen a los beneficiarios de las denominaciones de origen, o aquellas designadas al efecto, dispondrán los mecanismos que permitan un control efectivo del uso de las denominaciones de origen protegidas.

Artículo 214.- La protección de las denominaciones de origen se inicia con la declaración que al efecto emita la oficina nacional competente.

El uso de las mismas por personas no autorizadas que cree confusión, será considerado una infracción al derecho de propiedad industrial, objeto de sanción, incluyendo los casos en que vengan acompañadas de indicaciones tales como género, tipo, imitación y otras similares que creen confusión en el consumidor.

Artículo 215.- Los Países Miembros prohibirán la utilización de una denominación de origen que identifique vinos o bebidas espirituosas para productos de ese género que no sean originarios del lugar designado por la denominación de origen en cuestión, incluso cuando se indique el verdadero origen del producto o se utilice la indicación geográfica traducida o acompañada de expresiones tales como ""clase"", ""tipo"", ""estilo"", ""imitación"" u otras análogas.

Los Países Miembros no podrán impedir el uso continuado y similar de una denominación de origen de otro país, que identifique vinos o bebidas espirituosas con relación a productos o servicios, por alguno de sus nacionales que hayan utilizado esa

denominación de origen de manera continua para esos mismos productos o servicios, u otros afines, en el territorio del respectivo País Miembro durante 10 años como mínimo antes del 15 de abril de 1994, o de buena fe, antes de esa fecha.

Artículo 216.- La autoridad nacional competente podrá declarar, de oficio o a petición de parte, la nulidad de la autorización de uso de una denominación de origen protegida, si fue concedida en contravención a la presente Decisión. Serán de aplicación, en lo que fuere pertinente, las normas sobre nulidad de registro de marcas de la presente Decisión.

Artículo 217.- De oficio o a solicitud de parte, la oficina nacional competente, cancelará la autorización de uso, cuando se demuestre que la misma se utiliza en el comercio de una manera que no corresponde a lo indicado en la declaración de protección respectiva. Serán de aplicación, en lo que fuere pertinente, las normas sobre cancelación de registro de marcas de la presente Decisión.

Artículo 218.- Las oficinas nacionales competentes podrán reconocer las denominaciones de origen protegidas en otro País Miembro, cuando la solicitud la formulen sus productores, extractores, fabricantes o artesanos que tengan legítimo interés o las autoridades públicas de los mismos.

Para solicitar dicha protección, las denominaciones de origen deben haber sido declaradas como tales en sus países de origen.";Alta;Cuáles son las consecuencias de usar una denominación de origen protegida sin autorización?;Usar una denominación de origen protegida sin autorización puede considerarse una infracción al derecho de propiedad industrial, y será objeto de sanción. Específicamente, el uso no autorizado que cree confusión será considerado una infracción, lo que incluye casos en los que la denominación de origen viene acompañada de indicaciones tales como género, tipo, imitación y otras similares que puedan crear confusión en el consumidor.
"Artículo 219.- Tratándose de denominaciones de origen o indicaciones geográficas protegidas en terceros países, las oficinas nacionales competentes podrán reconocer la protección, siempre que ello esté previsto en algún convenio del cual el País Miembro sea parte. Para solicitar dicha protección, las denominaciones de origen deben haber sido declaradas como tales en sus países de origen.

Artículo 220.- Las denominaciones de origen protegidas conforme a lo previsto en la presente Decisión, no serán consideradas comunes o genéricas para distinguir el producto que designan, mientras subsista dicha protección en el país de origen.

CAPITULO II

De las Indicaciones de Procedencia

Artículo 221.- Se entenderá por indicación de procedencia un nombre, expresión, imagen o signo que designe o evoque un país, región, localidad o lugar determinado.

Artículo 222.- Una indicación de procedencia no podrá usarse en el comercio en relación con un producto o un servicio, cuando fuese falsa o engañosa con respecto a su origen o cuando su uso pudiera inducir al público a confusión con respecto al origen, procedencia, calidad o cualquier otra característica del producto o servicio.

A efectos de lo dispuesto en el párrafo anterior, también constituye uso de una indicación geográfica en el comercio el que se hiciera en la publicidad y en cualquier documentación comercial relativa a la venta, exposición u oferta de productos o servicios.

Artículo 223.- Toda persona podrá indicar su nombre o su domicilio sobre los productos que comercialice, aún cuando éstos provinieran de un país diferente, siempre

que se presente acompañado de la indicación precisa, en caracteres suficientemente destacados, del país o lugar de fabricación o de producción de los productos o de otra indicación suficiente para evitar cualquier error sobre el verdadero origen de los mismos.

TITULO XIII

DE LOS SIGNOS DISTINTIVOS NOTORIAMENTE CONOCIDOS

Artículo 224.- Se entiende por signo distintivo notoriamente conocido el que fuese reconocido como tal en cualquier País Miembro por el sector pertinente, independientemente de la manera o el medio por el cual se hubiese hecho conocido.

Artículo 225.- Un signo distintivo notoriamente conocido será protegido contra su uso y registro no autorizado conforme a este Título, sin perjuicio de las demás disposiciones de esta Decisión que fuesen aplicables y de las normas para la protección contra la competencia desleal del País Miembro.

Artículo 226.- Constituirá uso no autorizado del signo distintivo notoriamente conocido el uso del mismo en su totalidad o en una parte esencial, o una reproducción, imitación, traducción o transliteración del signo, susceptibles de crear confusión, en relación con establecimientos, actividades, productos o servicios idénticos o similares a los que se aplique.

También constituirá uso no autorizado del signo distintivo notoriamente conocido el uso del mismo en su totalidad o en una parte esencial, o de una reproducción, imitación, traducción o transliteración del signo, aun respecto de establecimientos, actividades, productos o servicios diferentes a los que se aplica el signo notoriamente conocido, o para fines no comerciales, si tal uso pudiese causar alguno de los efectos siguientes:

	riesgo de confusión o de asociación con el titular del signo, o con sus establecimientos, actividades, productos o servicios;

	daño económico o comercial injusto al titular del signo por razón de una dilución de la fuerza distintiva o del valor comercial o publicitario del signo; o,

	aprovechamiento injusto del prestigio o del renombre del signo.

El uso podrá verificarse a través de cualquier medio de comunicación, incluyendo los electrónicos.

Artículo 227.- Será de aplicación al presente Título lo establecido en el literal h) del artículo 136, así como lo dispuesto en el artículo 155, literales e) y f).";Alta;Qué condiciones deben cumplir las denominaciones de origen para ser reconocidas como protegidas en terceros países según este documento legal?;"Según el contexto proporcionado, para que una denominación de origen sea reconocida como protegida en terceros países, debe cumplirse la siguiente condición:

1. Debe haber sido declarada como tal en su país de origen.

Esta declaración es un requisito previo necesario para solicitar la protección internacional según lo estipula el Artículo 219 del documento legal."
"Artículo 228.- Para determinar la notoriedad de un signo distintivo, se tomará en consideración entre otros, los siguientes factores:

	el grado de su conocimiento entre los miembros del sector pertinente dentro de cualquier País Miembro;

	la duración, amplitud y extensión geográfica de su utilización, dentro o fuera de cualquier País Miembro;

		la duración, amplitud y extensión geográfica de su promoción, dentro o fuera de cualquier País Miembro, incluyendo la publicidad y la presentación en ferias, exposiciones u otros eventos de los productos o servicios, del establecimiento o de la actividad a los que se aplique;

		el valor de toda inversión efectuada para promoverlo, o para promover el establecimiento, actividad, productos o servicios a los que se aplique;

		las cifras de ventas y de ingresos de la empresa titular en lo que respecta al signo cuya notoriedad se alega, tanto en el plano internacional como en el del País Miembro en el que se pretende la protección;

	el grado de distintividad inherente o adquirida del signo;

	el valor contable del signo como activo empresarial;

		el volumen de pedidos de personas interesadas en obtener una franquicia o licencia del signo en determinado territorio; o,

		la existencia de actividades significativas de fabricación, compras o almacenamiento por el titular del signo en el País Miembro en que se busca protección;

	los aspectos del comercio internacional; o,

		la existencia y antigüedad de cualquier registro o solicitud de registro del signo distintivo en el País Miembro o en el extranjero.

Artículo 229.- No se negará la calidad de notorio a un signo por el solo hecho que:

	no esté registrado o en trámite de registro en el País Miembro o en el extranjero;

		no haya sido usado o no se esté usando para distinguir productos o servicios, o para identificar actividades o establecimientos en el País Miembro; o,

	no sea notoriamente conocido en el extranjero.

Artículo 230.- Se considerarán como sectores pertinentes de referencia para determinar la notoriedad de un signo distintivo, entre otros, los siguientes:

		los consumidores reales o potenciales del tipo de productos o servicios a los que se aplique;

		las personas que participan en los canales de distribución o comercialización del tipo de productos o servicios a los que se aplique; o,

		los círculos empresariales que actúan en giros relativos al tipo de establecimiento, actividad, productos o servicios a los que se aplique.

Para efectos de reconocer la notoriedad de un signo bastará que sea conocido dentro de cualquiera de los sectores referidos en los literales anteriores.

Artículo 231.- El titular de un signo distintivo notoriamente conocido tendrá acción para prohibir su uso a terceros y a ejercer ante la autoridad nacional competente las acciones y medidas que correspondan. Asimismo el titular podrá impedir a cualquier tercero realizar con respecto al signo los actos indicados en el artículo 155, siendo aplicables las limitaciones previstas en los artículos 157 y 158.

Artículo 232.- La acción contra un uso no autorizado de un signo distintivo notoriamente conocido prescribirá a los cinco años contados desde la fecha en que el titular del signo tuvo conocimiento de tal uso, salvo que éste se hubiese iniciado de mala fe, en cuyo caso no prescribirá la acción. Esta acción no afectará la que pudiera corresponder por daños y perjuicios conforme al derecho común.";Alta;Cuáles son los factores considerados para determinar la notoriedad de un signo distintivo según el artículo 228?;"Según el Artículo 228, se consideran varios factores para determinar la notoriedad de un signo distintivo, entre ellos:

1. El grado de su conocimiento entre los miembros del sector pertinente dentro de cualquier País Miembro.
2. La duración, amplitud y extensión geográfica de su utilización, tanto dentro como fuera de cualquier País Miembro.
3. La duración, amplitud y extensión geográfica de su promoción, incluyendo publicidad y presentación en ferias, exposiciones u otros eventos.
4. El valor de toda inversión efectuada para promover el signo, o para promover el establecimiento, actividad, productos o servicios a los que se aplique.
5. Las cifras de ventas y de ingresos de la empresa titular en lo que respecta al signo cuya notoriedad se alega, tanto en el plano internacional como en el del País Miembro en el que se pretende la protección.
6. El grado de distintividad inherente o adquirida del signo.
7. El valor contable del signo como activo empresarial.
8. El volumen de pedidos de personas interesadas en obtener una franquicia o licencia del signo en determinado territorio.
9. La existencia de actividades significativas de fabricación, compras o almacenamiento por el titular del signo en el País Miembro en que se busca protección.
10. Los aspectos del comercio internacional.
11. La existencia y antigüedad de cualquier registro o solicitud de registro del signo distintivo en el País Miembro o en el extranjero."
"Artículo 233.- Cuando un signo distintivo notoriamente conocido se hubiese inscrito indebidamente en el País Miembro como parte de un nombre de dominio o de una dirección de correo electrónico por un tercero no autorizado, a pedido del titular o legítimo poseedor de ese signo la autoridad nacional competente ordenará la cancelación o la modificación de la inscripción del nombre de dominio o dirección de correo electrónico, siempre que el uso de ese nombre o dirección fuese susceptible de tener alguno de los efectos mencionados en el primer y segundo párrafos del artículo 226.

Artículo 234.- Al resolver sobre una acción relativa al uso no autorizado de un signo distintivo notoriamente conocido, la autoridad nacional competente tendrá en cuenta la buena o mala fe de las partes en la adopción y utilización de ese signo.

Artículo 235.- Sin perjuicio del ejercicio de las causales de cancelación previstas en los artículos 165 y 169, en caso que las normas nacionales así lo dispongan, la oficina nacional competente cancelará el registro de una marca, a petición del titular legítimo, cuando ésta sea idéntica o similar a una que hubiese sido notoriamente conocida, de acuerdo con la legislación vigente, al momento de solicitarse el registro.

Artículo 236.- Serán aplicables al presente Título las disposiciones contenidas en la presente Decisión, en lo que fuere pertinente.

TITULO XIV

DE LA ACCION REIVINDICATORIA

Artículo 237.- Cuando una patente o un registro de diseño industrial se hubiese solicitado u obtenido por quien no tenía derecho a obtenerlo, o en perjuicio de otra persona que también tuviese tal derecho, la persona afectada podrá reivindicarlo ante la autoridad nacional competente pidiendo que le sea transferida la solicitud en trámite o el derecho concedido, o que se le reconozca como cosolicitante o cotitular del derecho.

Cuando un registro de marca se hubiese solicitado u obtenido en perjuicio de otra persona que también tuviese tal derecho, la persona afectada podrá reivindicarlo ante la autoridad nacional competente pidiendo que se le reconozca como cosolicitante o cotitular del derecho.

Si la legislación interna del País Miembro lo permite, en la misma acción de reivindicación podrá demandarse la indemnización de daños y perjuicios.";Alta;Qué acciones puede tomar una persona afectada cuando se solicita u obtiene una patente o registro de diseño industrial sin derecho a hacerlo?;"Según el contexto proporcionado, una persona afectada que ve que se ha solicitado u obtenido una patente o registro de diseño industrial sin tener derecho a ello puede tomar las siguientes acciones:

1. Puede reivindicar la solicitud en trámite o el derecho concedido ante la autoridad nacional competente.
2. Solicitar que le sea transferida la solicitud en trámite.
3. Pedir que se le reconozca como cosolicitante o cotitular del derecho.

Estas acciones son específicas para los casos en que una patente o registro de diseño industrial ha sido solicitado u obtenido por quien no tenía derecho a hacerlo, o en perjuicio de otra persona que también tuviese tal derecho."
"- 17 -

- 17 -

TITULO VI

DE LAS MARCAS

CAPITULO I

De los Requisitos para el Registro de Marcas

Artículo 134.- A efectos de este régimen constituirá marca cualquier signo que sea apto para distinguir productos o servicios en el mercado. Podrán reg";Alta;Qué signos no podrán registrarse como marcas según los artículos 134 y 135?;"Según los artículos 134 y 135, los signos que no podrán registrarse como marcas son:

1. Los que carezcan de distintividad.
2. Los que consistan exclusivamente en formas usuales de los productos o de sus envases, o en formas u otros elementos que den una ventaja funcional o técnica al producto o servicio.
3. Los que consistan exclusivamente en un signo o indicación que pueda servir en el comercio para describir la calidad, la cantidad, el destino, el valor, la procedencia geográfica, la época de producción u otros datos, características o informaciones de los productos o servicios.
4. Los que consistan exclusivamente en el nombre genérico o técnico del producto o servicio.
5. Los que hayan convertido en una designación común o usual del producto o servicio en el lenguaje corriente o en la usanza del país.
6. Los colores considerados aisladamente, sin estar delimitados por una forma específica.
7. Los signos que puedan engañar a los medios comerciales o al público sobre la procedencia geográfica, la naturaleza, el modo de fabricación, las características, cualidades o aptitud para el empleo de los productos o servicios.
8. Las denominaciones de origen protegidas para vinos y bebidas espirituosas.
9. Las indicaciones geográficas nacionales o extranjeras que puedan inducir a confusión respecto a los productos o servicios a los cuales se apliquen.
10. Los signos que reproduzcan, imiten o contengan una denominación de origen protegida para los mismos productos o para productos diferentes, cuando su uso pudiera causar un riesgo de confusión o de asociación con la denominación; o implicase un aprovechamiento injusto de su notoriedad.
11. Los signos que reproduzcan o imiten, sin permiso de las autoridades competentes, los escudos de armas, banderas, emblemas, signos y punzones oficiales de control y de garantía de los Estados y toda imitación desde el punto de vista heráldico.
12. Los signos que reproduzcan o imiten escudos de armas, banderas y otros emblemas, siglas o denominaciones de cualquier organización internacional.
13. Los signos de conformidad con normas técnicas que no sean solicitados por el organismo nacional competente en normas y calidades en los Países Miembros.
14. Las denominaciones de una variedad vegetal protegida en un País Miembro o en el extranjero, si el signo se destinara a productos o servicios relativos a esa variedad o su uso fuere susceptible de causar confusión o asociación con la variedad."
